{"schema_version":2,"id":"return-guide","version":"1.0.0","engine":{"min":"1.0.0","max_exclusive":"2.0.0"},"required_actions":[{"name":"order.status","versions":{"min":"1.0.0","max_exclusive":"2.0.0"}}],"resources":[{"path":"references/input.json","sha256":"5bc7002a95431c019d2eef7da0fe4821808be64701f2661e0ff6752f8d6fe2c3"},{"path":"references/output.json","sha256":"9ddd0041a0c3d18e3b929ba9b86711d5ef0d3e189af977772c032c9d6384236c"},{"path":"references/config.json","sha256":"eb61d4d68297f7fe261221af6ecee8017da99291ec362f0f3c64373f0883b7a2"},{"path":"references/guide.md","sha256":"646d0c18515d9f9908635aadbe37c55d62f0eb9c6e120490c92cc1c1d8a12b2e"}],"input_schema":"references/input.json","output_schema":"references/output.json","configuration":{"schema_resource":"references/config.json","fields":["returns.window_days"]},"scripts":[],"egress":[]}